<?xml version="1.0" encoding="UTF-8" standalone="no"?>
<xs:schema xmlns:xs="http://www.w3.org/2001/XMLSchema" elementFormDefault="qualified" version="1.7">

    <xs:element name="ehcache">
        <xs:complexType>
            <xs:sequence>
                <xs:element maxOccurs="1" minOccurs="0" ref="diskStore"/>
                <xs:element maxOccurs="1" minOccurs="0" ref="cacheManagerEventListenerFactory"/>
                <xs:element maxOccurs="unbounded" minOccurs="0" ref="cacheManagerPeerProviderFactory"/>
                <xs:element maxOccurs="unbounded" minOccurs="0" ref="cacheManagerPeerListenerFactory"/>
                <xs:element maxOccurs="1" minOccurs="0" ref="terracottaConfig"/>
                <xs:element ref="defaultCache"/>
                <xs:element maxOccurs="unbounded" minOccurs="0" ref="cache"/>
            </xs:sequence>
            <xs:attribute name="name" use="optional"/>
            <xs:attribute default="true" name="updateCheck" type="xs:boolean" use="optional"/>
            <xs:attribute default="autodetect" name="monitoring" type="monitoringType" use="optional"/>
            <xs:attribute name="transactionManagerLookupClass" type="xs:string" use="optional"/>
            <xs:attribute default="true" name="dynamicConfig" type="xs:boolean" use="optional"/>
        </xs:complexType>
    </xs:element>
    <xs:element name="diskStore">
        <xs:complexType>
            <xs:attribute name="path" use="optional"/>
        </xs:complexType>
    </xs:element>
    <xs:element name="cacheManagerEventListenerFactory">
        <xs:complexType>
            <xs:attribute name="class" use="required"/>
            <xs:attribute name="properties" use="optional"/>
            <xs:attribute name="propertySeparator" use="optional"/>
        </xs:complexType>
    </xs:element>
    <xs:element name="cacheManagerPeerProviderFactory">
        <xs:complexType>
            <xs:attribute name="class" use="required"/>
            <xs:attribute name="properties" use="optional"/>
            <xs:attribute name="propertySeparator" use="optional"/>
        </xs:complexType>
    </xs:element>
    <xs:element name="cacheManagerPeerListenerFactory">
        <xs:complexType>
            <xs:attribute name="class" use="required"/>
            <xs:attribute name="properties" use="optional"/>
            <xs:attribute name="propertySeparator" use="optional"/>
        </xs:complexType>
    </xs:element>
    <xs:element name="terracottaConfig">
        <xs:complexType>
            <xs:sequence>
                <xs:element maxOccurs="1" minOccurs="0" name="tc-config">
                    <xs:complexType>
                        <xs:sequence>
                            <xs:any maxOccurs="unbounded" minOccurs="0" processContents="skip"/>
                        </xs:sequence>
                    </xs:complexType>
                </xs:element>
            </xs:sequence>
            <xs:attribute default="localhost:9510" name="url" use="optional"/>
            <xs:attribute name="registerStatsMBean" type="xs:boolean" use="optional"/>
        </xs:complexType>
    </xs:element>
    <!-- add clone support for addition of cacheExceptionHandler. Important! -->
    <xs:element name="defaultCache">
        <xs:complexType>
            <xs:sequence>
                <xs:element maxOccurs="unbounded" minOccurs="0" ref="cacheEventListenerFactory"/>
                <xs:element maxOccurs="unbounded" minOccurs="0" ref="cacheExtensionFactory"/>
                <xs:element maxOccurs="unbounded" minOccurs="0" ref="cacheLoaderFactory"/>
                <xs:element maxOccurs="1" minOccurs="0" ref="bootstrapCacheLoaderFactory"/>
                <xs:element maxOccurs="1" minOccurs="0" ref="cacheExceptionHandlerFactory"/>
                <xs:element maxOccurs="1" minOccurs="0" ref="terracotta"/>
            </xs:sequence>
            <xs:attribute name="diskExpiryThreadIntervalSeconds" type="xs:integer" use="optional"/>
            <xs:attribute name="diskSpoolBufferSizeMB" type="xs:integer" use="optional"/>
            <xs:attribute name="diskPersistent" type="xs:boolean" use="optional"/>
            <xs:attribute name="eternal" type="xs:boolean" use="required"/>
            <xs:attribute name="maxElementsInMemory" type="xs:integer" use="required"/>
            <xs:attribute name="clearOnFlush" type="xs:boolean" use="optional"/>
            <xs:attribute name="memoryStoreEvictionPolicy" type="xs:string" use="optional"/>
            <xs:attribute name="overflowToDisk" type="xs:boolean" use="required"/>
            <xs:attribute name="timeToIdleSeconds" type="xs:integer" use="optional"/>
            <xs:attribute name="timeToLiveSeconds" type="xs:integer" use="optional"/>
            <xs:attribute name="maxElementsOnDisk" type="xs:integer" use="optional"/>
            <xs:attribute default="off" name="transactionalMode" type="transactionalMode" use="optional"/>
        </xs:complexType>
    </xs:element>
    <xs:element name="cache">
        <xs:complexType>
            <xs:sequence>
                <xs:element maxOccurs="unbounded" minOccurs="0" ref="cacheEventListenerFactory"/>
                <xs:element maxOccurs="unbounded" minOccurs="0" ref="cacheExtensionFactory"/>
                <xs:element maxOccurs="unbounded" minOccurs="0" ref="cacheLoaderFactory"/>
                <xs:element maxOccurs="1" minOccurs="0" ref="bootstrapCacheLoaderFactory"/>
                <xs:element maxOccurs="1" minOccurs="0" ref="cacheExceptionHandlerFactory"/>
                <xs:element maxOccurs="1" minOccurs="0" ref="terracotta"/>
            </xs:sequence>
            <xs:attribute name="diskExpiryThreadIntervalSeconds" type="xs:integer" use="optional"/>
            <xs:attribute name="diskSpoolBufferSizeMB" type="xs:integer" use="optional"/>
            <xs:attribute name="diskPersistent" type="xs:boolean" use="optional"/>
            <xs:attribute name="eternal" type="xs:boolean" use="required"/>
            <xs:attribute name="maxElementsInMemory" type="xs:integer" use="required"/>
            <xs:attribute name="memoryStoreEvictionPolicy" type="xs:string" use="optional"/>
            <xs:attribute name="clearOnFlush" type="xs:boolean" use="optional"/>
            <xs:attribute name="name" type="xs:string" use="required"/>
            <xs:attribute name="overflowToDisk" type="xs:boolean" use="required"/>
            <xs:attribute name="timeToIdleSeconds" type="xs:integer" use="optional"/>
            <xs:attribute name="timeToLiveSeconds" type="xs:integer" use="optional"/>
            <xs:attribute name="maxElementsOnDisk" type="xs:integer" use="optional"/>
            <xs:attribute default="off" name="transactionalMode" type="transactionalMode" use="optional"/>
        </xs:complexType>
    </xs:element>
    <xs:element name="cacheEventListenerFactory">
        <xs:complexType>
            <xs:attribute name="class" use="required"/>
            <xs:attribute name="properties" use="optional"/>
            <xs:attribute name="propertySeparator" use="optional"/>
        </xs:complexType>
    </xs:element>
    <xs:element name="bootstrapCacheLoaderFactory">
        <xs:complexType>
            <xs:attribute name="class" use="required"/>
            <xs:attribute name="properties" use="optional"/>
            <xs:attribute name="propertySeparator" use="optional"/>
        </xs:complexType>
    </xs:element>
    <xs:element name="cacheExtensionFactory">
        <xs:complexType>
            <xs:attribute name="class" use="required"/>
            <xs:attribute name="properties" use="optional"/>
            <xs:attribute name="propertySeparator" use="optional"/>
        </xs:complexType>
    </xs:element>
    <xs:element name="cacheExceptionHandlerFactory">
        <xs:complexType>
            <xs:attribute name="class" use="required"/>
            <xs:attribute name="properties" use="optional"/>
            <xs:attribute name="propertySeparator" use="optional"/>
        </xs:complexType>
    </xs:element>
    <xs:element name="cacheLoaderFactory">
        <xs:complexType>
            <xs:attribute name="class" use="required"/>
            <xs:attribute name="properties" use="optional"/>
            <xs:attribute name="propertySeparator" use="optional"/>
        </xs:complexType>
    </xs:element>
    <xs:element name="terracotta">
        <xs:complexType>
            <xs:attribute default="true" name="clustered" type="xs:boolean" use="optional"/>
            <xs:attribute default="serialization" name="valueMode" type="terracottaCacheValueType" use="optional"/>
            <xs:attribute default="true" name="coherentReads" type="xs:boolean" use="optional"/>
            <xs:attribute default="false" name="localKeyCache" type="xs:boolean" use="optional"/>
            <xs:attribute default="10000" name="localKeyCacheSize" type="xs:positiveInteger" use="optional"/>
            <xs:attribute default="true" name="orphanEviction" type="xs:boolean" use="optional"/>
            <xs:attribute default="4" name="orphanEvictionPeriod" type="xs:positiveInteger" use="optional"/>
            <xs:attribute name="copyOnRead" use="optional" type="xs:boolean" default="false"/>
        </xs:complexType>
    </xs:element>
    <xs:simpleType name="monitoringType">
        <xs:restriction base="xs:string">
            <xs:enumeration value="autodetect"/>
            <xs:enumeration value="on"/>
            <xs:enumeration value="off"/>
        </xs:restriction>
    </xs:simpleType>
    <xs:simpleType name="terracottaCacheValueType">
        <xs:restriction base="xs:string">
            <xs:enumeration value="serialization"/>
            <xs:enumeration value="identity"/>
        </xs:restriction>
    </xs:simpleType>
    <xs:simpleType name="transactionalMode">
        <xs:restriction base="xs:string">
            <xs:enumeration value="off"/>
            <xs:enumeration value="xa"/>
        </xs:restriction>
    </xs:simpleType>
</xs:schema>
