<?xml version="1.0" encoding="UTF-8"?>

<ehcache xmlns:xsi="http://www.w3.org/2001/XMLSchema-instance"
	xsi:noNamespaceSchemaLocation="../../main/config/ehcache.xsd">

	<defaultCache maxElementsInMemory="10" eternal="false"
		timeToIdleSeconds="5" timeToLiveSeconds="10" overflowToDisk="true" />

	<cache name="defaultStorageStrategy" maxElementsInMemory="10"
		eternal="false" timeToIdleSeconds="5" timeToLiveSeconds="10"
		overflowToDisk="true" copyOnRead="true">
		<terracotta clustered="false" />
	</cache>
	
	<cache name="localStorageStrategy" maxElementsInMemory="10"
		eternal="false" timeToIdleSeconds="5" timeToLiveSeconds="10"
		overflowToDisk="true" copyOnRead="true">
		<terracotta clustered="false" storageStrategy="local" />
	</cache>
	
	<cache name="serverStorageStrategy" maxElementsInMemory="10"
		eternal="false" timeToIdleSeconds="5" timeToLiveSeconds="10"
		overflowToDisk="true" copyOnRead="true">
		<terracotta clustered="false" storageStrategy="server" />
	</cache>
</ehcache>