<ehcache xmlns:xsi="http://www.w3.org/2001/XMLSchema-instance"
         xsi:noNamespaceSchemaLocation="ehcache.xsd">


    <cacheManagerPeerProviderFactory
            class="net.sf.ehcache.distribution.RMICacheManagerPeerProviderFactory"
            properties="peerDiscovery=automatic,
                        multicastGroupAddress=230.0.0.1,
                        multicastGroupPort=4446, timeToLive=1"
            propertySeparator=","
            />

    <!--listenToTopic=true which is the default.-->
    <cacheManagerPeerProviderFactory
            class="net.sf.ehcache.distribution.jms.JMSCacheManagerPeerProviderFactory"
            properties="initialContextFactoryName=com.sun.jndi.fscontext.RefFSContextFactory,
                providerURL=file:///tmp,
                replicationTopicConnectionFactoryBindingName=MyConnectionFactory,
                replicationTopicBindingName=ehcache,
                getQueueConnectionFactoryBindingName=queueConnectionFactory,
                getQueueBindingName=ehcacheGetQueue"
            propertySeparator=","
            />

    <cacheManagerPeerListenerFactory
            class="net.sf.ehcache.distribution.RMICacheManagerPeerListenerFactory"/>


    <defaultCache
            maxElementsInMemory="10000"
            eternal="false"
            timeToIdleSeconds="120"
            timeToLiveSeconds="120"
            overflowToDisk="false"
            memoryStoreEvictionPolicy="FIFO">
    </defaultCache>


    <cache name="sampleCacheAsync"
           maxElementsInMemory="1000"
           eternal="false"
           timeToIdleSeconds="1000"
           timeToLiveSeconds="1000"
           overflowToDisk="false">
        <cacheEventListenerFactory class="net.sf.ehcache.distribution.jms.JMSCacheReplicatorFactory"
                                   properties="replicateAsynchronously=true,
                                                replicatePuts=true,
                                                replicateUpdates=true,
                                                replicateUpdatesViaCopy=true,
                                                replicateRemovals=true,
                                                asynchronousReplicationIntervalMillis=1000"
                                   propertySeparator=","/>
    </cache>


    <cache name="sampleCacheSync"
           maxElementsInMemory="10000"
           eternal="false"
           timeToIdleSeconds="120"
           timeToLiveSeconds="120"
           overflowToDisk="false"
           memoryStoreEvictionPolicy="FIFO">
        <cacheEventListenerFactory class="net.sf.ehcache.distribution.jms.JMSCacheReplicatorFactory"
                                   properties="replicateAsynchronously=false,
                                                 replicatePuts=true,
                                                 replicateUpdates=true,
                                                 replicateUpdatesViaCopy=true,
                                                 replicateRemovals=true"
                                   propertySeparator=","/>
    </cache>

    <cache name="sampleCacheNorep"
           maxElementsInMemory="1000"
           eternal="false"
           timeToIdleSeconds="100000"
           timeToLiveSeconds="100000"
           overflowToDisk="false">
        <cacheEventListenerFactory class="net.sf.ehcache.distribution.jms.JMSCacheReplicatorFactory"
                                   properties="replicateAsynchronously=false, replicatePuts=false,
                                     replicateUpdates=false, replicateUpdatesViaCopy=false,
                                     replicateRemovals=false"
                                   propertySeparator=","/>
        <cacheLoaderFactory class="net.sf.ehcache.distribution.jms.JMSCacheLoaderFactory"
                            properties="initialContextFactoryName=com.sun.jndi.fscontext.RefFSContextFactory,
                providerURL=file:///tmp,
                getQueueConnectionFactoryBindingName=queueConnectionFactory,
                getQueueBindingName=ehcacheGetQueue,
                timeoutMillis=10000,
                userName=test,
                password=test"/>
    </cache>

    <cache name="sampleJMSReplicateRMIBootstrap"
           maxElementsInMemory="1000"
           eternal="false"
           timeToIdleSeconds="1000"
           timeToLiveSeconds="1000"
           overflowToDisk="false">
        <cacheEventListenerFactory class="net.sf.ehcache.distribution.jms.JMSCacheReplicatorFactory"
                                   properties="replicateAsynchronously=true,
                                                replicatePuts=true,
                                                replicateUpdates=true,
                                                replicateUpdatesViaCopy=true,
                                                replicateRemovals=true,
                                                asynchronousReplicationIntervalMillis=1000"
                                   propertySeparator=","/>
        <bootstrapCacheLoaderFactory
                class="net.sf.ehcache.distribution.RMIBootstrapCacheLoaderFactory"
                properties="bootstrapAsynchronously=true, maximumChunkSizeBytes=5000000"
                propertySeparator=","/>
    </cache>


</ehcache>
